{
  "id": "enterprise",
  "label": "Enterprise",
  "order": 10,
  "audience": "Large or regulated organisation, shared deployment, compliance obligations.",
  "tls": "required",
  "demoAuthSeverity": "critical",
  "summary": "SSO + the full hardening surface expected.",
  "relaxes": [],
  "presetEnv": [
    { "key": "OIDC_ISSUER_URL", "why": "SSO via your IdP" },
    { "key": "SCIM_TOKEN", "why": "user provisioning/deprovisioning" },
    { "key": "KMS_PROVIDER", "value": "aws|azure", "why": "BYOK envelope for keys" },
    { "key": "IP_ALLOWLIST", "why": "restrict to your networks" },
    { "key": "DUAL_CONTROL_ACTIONS", "value": "key.revoke,maintenance.engage,role_map.update", "why": "four-eyes on sensitive ops (incl. admin-authority mapping)" },
    { "key": "AUDIT_HTTP_URL", "why": "ship the tamper-evident audit to your SIEM" }
  ],
  "recommend": ["OIDC SSO + SCIM", "KMS/BYOK", "IP allowlist", "Maker-checker", "Ship audit to a SIEM", "Serve over HTTPS"]
}
