{
  "id": "nonprofit",
  "label": "Non-profit / charity",
  "order": 30,
  "audience": "Small team, often without a corporate IdP, cost-sensitive.",
  "tls": "lan-ok",
  "demoAuthSeverity": "warn",
  "summary": "The bundled IdP gives real accounts; HTTP on a trusted network is acceptable by choice.",
  "relaxes": ["Plain HTTP on a trusted LAN", "No corporate IdP required (use the bundled one)"],
  "presetEnv": [
    { "key": "SESSION_SECRET", "why": "signs cookies" },
    { "key": "OIDC_ISSUER_URL", "value": "http://authentik/…", "why": "the BUNDLED IdP — real staff accounts + roles, no cloud" }
  ],
  "recommend": ["Use the bundled IdP (Authentik) for staff accounts + roles", "Enable HTTPS if reachable beyond the LAN", "Set a strong SESSION_SECRET"]
}
